{
  "$schema": "https://docs.oasis-open.org/mqtt/mqtt-sn/v2.0/schema/packet-dictionary.json",
  "title": "MQTT-SN v2.0 (CSD01 draft) -- Packet Dictionary",
  "description": "Machine-readable companion to the prose, generated from the bytefield (.edn) diagram sources -- not hand-maintained. See bin/README (or AGENTS.md) for the generation pipeline.",
  "packet_count": 29,
  "packets": [
    {
      "order": 2,
      "section": {
        "number": "2.1",
        "title": "Structure of an MQTT-SN Control Packet",
        "anchor": "structure-of-an-mqtt-sn-control-packet",
        "path": [
          {
            "number": "2.",
            "title": "MQTT-SN Control Packet format"
          },
          {
            "number": "2.1",
            "title": "Structure of an MQTT-SN Control Packet"
          }
        ]
      },
      "code": null,
      "description": "Structure of an MQTT-SN Control Packet",
      "figure": {
        "label": "fig-packet-structure",
        "image": "images/structure-packet-diagram.png",
        "alt": "Packet Structure"
      },
      "source_edn": "images/packet/structure-packet-diagram.edn",
      "boxes_per_row": 9,
      "rows": []
    },
    {
      "order": 6,
      "section": {
        "number": "3.1",
        "title": "CONNECT - Connection Request",
        "anchor": "connect---connection-request",
        "path": [
          {
            "number": "3.",
            "title": "MQTT-SN Control Packets"
          },
          {
            "number": "3.1",
            "title": "CONNECT - Connection Request"
          }
        ]
      },
      "code": "CONNECT",
      "description": "Connection Request",
      "figure": {
        "label": "fig-connect-packet",
        "image": "images/connect-packet-diagram.png",
        "alt": "CONNECT Packet"
      },
      "source_edn": "images/packet/connect-packet-diagram.edn",
      "boxes_per_row": 9,
      "rows": [
        {
          "type": "field",
          "address": "1",
          "name": "Length",
          "kind": "box",
          "annotations": [],
          "optional": false,
          "group": null,
          "group_annotations": []
        },
        {
          "type": "field",
          "address": "2",
          "name": "Packet Type",
          "kind": "box",
          "annotations": [],
          "optional": false,
          "group": null,
          "group_annotations": []
        },
        {
          "type": "bit_field",
          "address": "3",
          "group": "Connect Flags",
          "group_annotations": [],
          "bits": [
            {
              "name": "Reserved",
              "span": 1,
              "value": "0",
              "optional": true
            },
            {
              "name": "Srv Sugg",
              "span": 1,
              "value": "X",
              "optional": true
            },
            {
              "name": "Net Addr",
              "span": 1,
              "value": "X",
              "optional": true
            },
            {
              "name": "MAM",
              "span": 1,
              "value": "X",
              "optional": true
            },
            {
              "name": "Sess Exp",
              "span": 1,
              "value": "X",
              "optional": true
            },
            {
              "name": "Auth",
              "span": 1,
              "value": "X",
              "optional": true
            },
            {
              "name": "Will",
              "span": 1,
              "value": "X",
              "optional": true
            },
            {
              "name": "Clean Start",
              "span": 1,
              "value": "X",
              "optional": true
            }
          ]
        },
        {
          "type": "bit_field",
          "address": "4",
          "group": "Will Flags",
          "group_annotations": [
            {
              "style": "cursive",
              "text": " (F=1 or 0) - only present when Will flag is set"
            }
          ],
          "bits": [
            {
              "name": "Reserved",
              "span": 3,
              "value": "000",
              "optional": true
            },
            {
              "name": "Wil Retain",
              "span": 1,
              "value": "X",
              "optional": true
            },
            {
              "name": "Will QoS",
              "span": 2,
              "value": "XX",
              "optional": true
            },
            {
              "name": "Will Topic Type",
              "span": 2,
              "value": "XX",
              "optional": true
            }
          ]
        },
        {
          "type": "field",
          "address": "4+F",
          "name": "Packet Identifier MSB",
          "kind": "box",
          "annotations": [],
          "optional": false,
          "group": null,
          "group_annotations": []
        },
        {
          "type": "field",
          "address": "5+F",
          "name": "Packet Identifier LSB",
          "kind": "box",
          "annotations": [],
          "optional": false,
          "group": null,
          "group_annotations": []
        },
        {
          "type": "field",
          "address": "6+F",
          "name": "Protocol Version",
          "kind": "box",
          "annotations": [],
          "optional": false,
          "group": null,
          "group_annotations": []
        },
        {
          "type": "field",
          "address": "7+F",
          "name": "Keep Alive MSB",
          "kind": "box",
          "annotations": [],
          "optional": false,
          "group": null,
          "group_annotations": []
        },
        {
          "type": "field",
          "address": "8+F",
          "name": "Keep Alive LSB",
          "kind": "box",
          "annotations": [],
          "optional": false,
          "group": null,
          "group_annotations": []
        },
        {
          "type": "field",
          "address": "9+F",
          "name": "Maximum Packet Size MSB",
          "kind": "box",
          "annotations": [],
          "optional": false,
          "group": null,
          "group_annotations": []
        },
        {
          "type": "field",
          "address": "10+F",
          "name": "Maximum Packet Size LSB",
          "kind": "box",
          "annotations": [],
          "optional": false,
          "group": null,
          "group_annotations": []
        },
        {
          "type": "field",
          "address": "11+F",
          "name": "Maximum Number of Awake Messages",
          "kind": "box",
          "annotations": [
            {
              "style": "cursive",
              "text": " (AM=F+1 or F) - only present when MAM flag is set"
            }
          ],
          "optional": true,
          "group": null,
          "group_annotations": []
        },
        {
          "type": "field",
          "address": "11+AM",
          "name": "Session Expiry Interval MSB",
          "kind": "box",
          "annotations": [],
          "optional": true,
          "group": "Session Expiry Interval",
          "group_annotations": [
            {
              "style": "cursive",
              "text": " (S=AM+4 or AM) - only present when Sess Exp flag is set"
            }
          ]
        },
        {
          "type": "field",
          "address": "12+AM",
          "name": "Session Expiry Interval",
          "kind": "box",
          "annotations": [],
          "optional": true,
          "group": "Session Expiry Interval",
          "group_annotations": [
            {
              "style": "cursive",
              "text": " (S=AM+4 or AM) - only present when Sess Exp flag is set"
            }
          ]
        },
        {
          "type": "field",
          "address": "13+AM",
          "name": "Session Expiry Interval",
          "kind": "box",
          "annotations": [],
          "optional": true,
          "group": "Session Expiry Interval",
          "group_annotations": [
            {
              "style": "cursive",
              "text": " (S=AM+4 or AM) - only present when Sess Exp flag is set"
            }
          ]
        },
        {
          "type": "field",
          "address": "14+AM",
          "name": "Session Expiry Interval LSB",
          "kind": "box",
          "annotations": [],
          "optional": true,
          "group": "Session Expiry Interval",
          "group_annotations": [
            {
              "style": "cursive",
              "text": " (S=AM+4 or AM) - only present when Sess Exp flag is set"
            }
          ]
        },
        {
          "type": "field",
          "address": "11+S",
          "name": "Will Topic Alias or Will Topic Name Length MSB",
          "kind": "box",
          "annotations": [],
          "optional": true,
          "group": "Will Fields",
          "group_annotations": [
            {
              "style": "cursive",
              "text": " (W=4+N+P+S or S) - only present when Will flag is set"
            }
          ]
        },
        {
          "type": "field",
          "address": "12+S",
          "name": "Will Topic Alias or Will Topic Name Length LSB",
          "kind": "box",
          "annotations": [],
          "optional": true,
          "group": "Will Fields",
          "group_annotations": [
            {
              "style": "cursive",
              "text": " (W=4+N+P+S or S) - only present when Will flag is set"
            }
          ]
        },
        {
          "type": "field",
          "address": "13+S",
          "name": "Will Topic Name",
          "kind": "gap",
          "annotations": [
            {
              "style": "cursive",
              "text": " (N) - only present when Will Topic Type is Topic Name"
            }
          ],
          "optional": true,
          "group": "Will Fields",
          "group_annotations": [
            {